guaranteetype,warrantee
银行保函,安徽胜华建设工程有限公司
银行保函,郑州建安建筑工程有限公司
银行保函,南阳恒鑫建设工程有限公司
银行保函,湖北鄂州鲁班（集团）建筑开发有限责任公司
银行保函,重庆聚源建筑劳务有限公司
银行保函,重庆聚源建筑劳务有限公司
银行保函,广西建工集团第五建筑工程有限责任公司
银行保函,天山房地产开发集团有限公司
银行保函,中海海洋华兴建设有限公司
银行保函,合肥达美建筑装饰工程有限责任公司
银行保函,安徽禹安建设工程有限公司
银行保函,广东华烽工程有限公司
银行保函,昆明三建建设（集团）有限公司
银行保函,庐江乐成市政工程有限公司
银行保函,四川上辰德鑫建筑工程集团有限公司
银行保函,云南万盛建设工程集团有限公司
银行保函,浙江贝力装饰工程有限公司
银行保函,海南鸿跃建筑工程有限公司
银行保函,武汉广丰石油化工有限公司
银行保函,海南旺邦建筑工程有限公司
银行保函,中顺弘建设集团有限公司
银行保函,圣凯建设工程集团有限公司
银行保函,广东聚晟建设工程有限公司
银行保函,陕西林羽建筑工程有限公司
银行保函,江西华龙水利工程建设有限公司
银行保函,河北博安机电设备安装有限公司
银行保函,云南祥景建筑工程有限公司
银行保函,西安三建建设有限公司
银行保函,江西慧灵实业有限公司
银行保函,福建北极洋建设有限公司
银行保函,福建省轩庭建筑有限公司
银行保函,贵州万盛达建筑工程有限公司
银行保函,江苏金祥建设工程有限公司
银行保函,福建宏盛电力建设有限公司
银行保函,中良城建（海南）建设有限公司
银行保函,中际城市建设有限公司
银行保函,四川荣汇建设工程有限公司
银行保函,海南盛君建筑工程有限公司
银行保函,重庆意远建设工程有限公司
银行保函,安庆市博达建筑劳务有限公司
银行保函,福建杰宇建设工程有限公司
银行保函,上海强迅景观工程有限公司
银行保函,四川优茂建设工程有限公司
银行保函,四川和骏建设工程有限公司
银行保函,邯郸市第三建筑安装有限公司
银行保函,邢台市龙昌水利工程有限公司
银行保函,泽风工程有限公司
银行保函,河北宁泰路桥工程有限公司
银行保函,河北光太路桥工程集团有限公司
公司保函,山东鸿华建筑安装工程有限公司
公司保函,行唐县泽辉建筑工程有限公司
公司保函,石家庄熙轩市政工程有限公司
公司保函,行唐县泽辉建筑工程有限公司
公司保函,行唐县泽辉建筑工程有限公司
银行保函,重庆盛坚市政工程有限公司
银行保函,盐城市金江疏浚工程有限公司
银行保函,四川富华中盈建设有限公司
银行保函,重庆市富博建筑工程有限责任公司
银行保函,四川一沙兴蓉建设工程有限公司
银行保函,四川怡鑫建设工程有限公司
银行保函,中安龙山建设集团有限公司
银行保函,福建省凯特建设工程有限公司
银行保函,天津绿梦达园林市政工程发展有限公司
银行保函,重庆市毅昌建设工程有限公司
银行保函,重庆润广建筑工程有限公司
银行保函,江苏溧阳建设集团有限公司
银行保函,江苏华跃特种设备有限公司
银行保函,无锡市皖江建设工程有限公司
